{
  "schemaVersion": "1.0",
  "artifactType": "code-review-address",
  "provider": "<provider-id>",
  "repository": "<repository-id>",
  "pullRequest": "<pull-request-id>",
  "thread": "<thread-id>",
  "sourceRevision": "<authoritative-source-revision>",
  "targetRevision": "<authoritative-target-revision>",
  "iteration": "<provider-iteration-id>",
  "campaignTracker": ".engloop/out/code-review-response/campaigns/<campaign-sha256>/tracker.json",
  "campaignTrackerSha256": "<sha256>",
  "campaignItemId": "<sha256>",
  "campaignItemContentSha256": "<sha256>",
  "campaignDecisionReceiptId": "<receipt-id>",
  "campaignReceipt": ".engloop/out/code-review-response/campaign-receipts/<receipt-sha256>.json",
  "campaignReceiptSha256": "<sha256>",
  "actingPrincipal": "<authenticated-provider-principal>",
  "threadStatus": "active",
  "classification": "already-addressed",
  "initialHead": "<local-head-before>",
  "finalHead": "<local-head-after>",
  "initialStatusDigest": "<sha256>",
  "finalStatusDigest": "<sha256>",
  "changedFiles": [],
  "validationResults": [],
  "evidence": [
    "<evidence-reference>"
  ],
  "unresolvedRisks": [],
  "replyText": "<exact proposed reply>",
  "allowedOperations": [
    "reply"
  ],
  "requiredFixRevision": "",
  "providerHead": "<authoritative-provider-head>",
  "providerMutationPerformed": false,
  "commitPushPerformed": false,
  "adapterRequest": {}
}
